### ISSUE TITLE
rejected shares

### ISSUE THREAD

**Issue by bladedoyle** [SChernykh/p2pool#213]
Im seeing shares rejected by p2pool.

```
[2022-10-21 14:56:24.610]  cpu      rejected (1493/28) diff 247948 "Invalid job id" (17400 ms)
[2022-10-21 14:56:24.610]  net      new job from 23.124.76.211:3334 diff 247948 algo rx/0 height 2738379 (12 tx)
[2022-10-21 14:56:24.610]  net      new job from 23.124.76.211:3334 diff 247948 algo rx/0 height 2738379 (14 tx)
[2022-10-21 14:56:24.610]  net      no active pools, stop mining
```

There are no messages in p2pool logs related to this (I can increase the log level if that would help)

This is a tcpdump for the rejected share:
```
07:56:24.604979 IP 23.124.76.211.3334 > 172.17.0.2.34392: Flags [P.], seq 66284:66634, ack 10275, win 501, options [nop,nop,TS val 3211218506 ecr 1047759447], length 350
	0x0000:  2a1b e951 e0b2 0c9d 92cf 8340 0800 4500  *..Q.......@..E.
	0x0010:  0192 8b61 4000 3e06 9fa2 177c 4cd3 ac11  ...a@.>....|L...
	0x0020:  0002 0d06 8658 2d86 8c59 84ff 92b6 8018  .....X-..Y......
	0x0030:  01f5 df4c 0000 0101 080a bf67 4e4a 3e73  ...L.......gNJ>s
	0x0040:  8a57 7b22 6a73 6f6e 7270 6322 3a22 322e  .W{"jsonrpc":"2.
	0x0050:  3022 2c22 6d65 7468 6f64 223a 226a 6f62  0","method":"job
	0x0060:  222c 2270 6172 616d 7322 3a7b 2262 6c6f  ","params":{"blo
	0x0070:  6222 3a22 3130 3130 6263 6536 6361 3961  b":"1010bce6ca9a
	0x0080:  3036 3865 3062 3665 3263 3035 3136 3666  068e0b6e2c05166f
	0x0090:  3561 6130 3662 3764 6431 6463 3734 6136  5aa06b7dd1dc74a6
	0x00a0:  6538 3464 3035 3466 3537 6362 3663 3339  e84d054f57cb6c39
	0x00b0:  3963 6365 3331 3033 6430 6163 3638 6530  9cce3103d0ac68e0
	0x00c0:  6564 3030 3030 3030 3030 3033 3561 3438  ed00000000035a48
	0x00d0:  3963 3266 3330 3164 3936 3863 6639 6334  9c2f301d968cf9c4
	0x00e0:  3034 6130 6235 6566 6636 3338 3366 6536  04a0b5eff6383fe6
	0x00f0:  3833 3963 3639 3333 3936 3936 6238 6266  839c69339696b8bf
	0x0100:  6533 6637 3939 3935 6230 3032 222c 226a  e3f79995b002","j
	0x0110:  6f62 5f69 6422 3a22 6235 222c 2274 6172  ob_id":"b5","tar
	0x0120:  6765 7422 3a22 6161 3433 3030 3030 222c  get":"aa430000",
	0x0130:  2261 6c67 6f22 3a22 7278 2f30 222c 2268  "algo":"rx/0","h
	0x0140:  6569 6768 7422 3a32 3733 3833 3739 2c22  eight":2738379,"
	0x0150:  7365 6564 5f68 6173 6822 3a22 3261 3165  seed_hash":"2a1e
	0x0160:  3965 3037 3038 3139 3865 6436 6335 6637  9e0708198ed6c5f7
	0x0170:  6631 3830 3266 3038 3764 6336 6236 6465  f1802f087dc6b6de
	0x0180:  6134 6234 3139 3032 6637 3535 6364 3636  a4b41902f755cd66
	0x0190:  3730 3337 3138 6235 3038 6164 227d 7d0a  703718b508ad"}}.
07:56:24.605020 IP 192.168.2.225.34392 > 23.124.76.211.3334: Flags [.], ack 66634, win 1647, options [nop,nop,TS val 1047776421 ecr 3211218506], length 0
	0x0000:  0c9d 92cf 8340 2a1b e951 e0b2 0800 4500  .....@*..Q....E.
	0x0010:  0034 2d2d 4000 3f06 e6be c0a8 02e1 177c  .4--@.?........|
	0x0020:  4cd3 8658 0d06 84ff 92b6 2d86 8db7 8010  L..X......-.....
	0x0030:  066f 27ff 0000 0101 080a 3e73 cca5 bf67  .o'.......>s...g
	0x0040:  4e4a                                     NJ
07:56:24.610345 IP 23.124.76.211.3334 > 172.17.0.2.34392: Flags [P.], seq 66634:69149, ack 10275, win 501, options [nop,nop,TS val 3211218511 ecr 1047776421], length 2515
	0x0000:  2a1b e951 e0b2 0c9d 92cf 8340 0800 4500  *..Q.......@..E.
	0x0010:  0a07 8b62 4000 3e06 972c 177c 4cd3 ac11  ...b@.>..,.|L...
	0x0020:  0002 0d06 8658 2d86 8db7 84ff 92b6 8018  .....X-.........
	0x0030:  01f5 1a5c 0000 0101 080a bf67 4e4f 3e73  ...\.......gNO>s
	0x0040:  cca5 7b22 6a73 6f6e 7270 6322 3a22 322e  ..{"jsonrpc":"2.
	0x0050:  3022 2c22 6d65 7468 6f64 223a 226a 6f62  0","method":"job
	0x0060:  222c 2270 6172 616d 7322 3a7b 2262 6c6f  ","params":{"blo
	0x0070:  6222 3a22 3130 3130 6336 6536 6361 3961  b":"1010c6e6ca9a
	0x0080:  3036 3865 3062 3665 3263 3035 3136 3666  068e0b6e2c05166f
	0x0090:  3561 6130 3662 3764 6431 6463 3734 6136  5aa06b7dd1dc74a6
	0x00a0:  6538 3464 3035 3466 3537 6362 3663 3339  e84d054f57cb6c39
	0x00b0:  3963 6365 3331 3033 6430 6163 3638 6530  9cce3103d0ac68e0
	0x00c0:  6564 3030 3030 3030 3030 3539 3936 6237  ed000000005996b7
	0x00d0:  6339 3337 3262 6434 6162 3066 6131 6563  c9372bd4ab0fa1ec
	0x00e0:  6562 3932 3561 3465 6330 3733 6263 3834  eb925a4ec073bc84
	0x00f0:  6164 3165 3736 3935 3463 3432 3038 6137  ad1e76954c4208a7
	0x0100:  6332 3466 6335 3531 3962 3037 222c 226a  c24fc5519b07","j
	0x0110:  6f62 5f69 6422 3a22 6236 222c 2274 6172  ob_id":"b6","tar
	0x0120:  6765 7422 3a22 6161 3433 3030 3030 222c  get":"aa430000",
	0x0130:  2261 6c67 6f22 3a22 7278 2f30 222c 2268  "algo":"rx/0","h
	0x0140:  6569 6768 7422 3a32 3733 3833 3739 2c22  eight":2738379,"
	0x0150:  7365 6564 5f68 6173 6822 3a22 3261 3165  seed_hash":"2a1e
	0x0160:  3965 3037 3038 3139 3865 6436 6335 6637  9e0708198ed6c5f7
	0x0170:  6631 3830 3266 3038 3764 6336 6236 6465  f1802f087dc6b6de
	0x0180:  6134 6234 3139 3032 6637 3535 6364 3636  a4b41902f755cd66
	0x0190:  3730 3337 3138 6235 3038 6164 227d 7d0a  703718b508ad"}}.
	0x01a0:  7b22 6a73 6f6e 7270 6322 3a22 322e 3022  {"jsonrpc":"2.0"
	0x01b0:  2c22 6d65 7468 6f64 223a 226a 6f62 222c  ,"method":"job",
	0x01c0:  2270 6172 616d 7322 3a7b 2262 6c6f 6222  "params":{"blob"
	0x01d0:  3a22 3130 3130 6339 6536 6361 3961 3036  :"1010c9e6ca9a06
	0x01e0:  3865 3062 3665 3263 3035 3136 3666 3561  8e0b6e2c05166f5a
	0x01f0:  6130 3662 3764 6431 6463 3734 6136 6538  a06b7dd1dc74a6e8
	0x0200:  3464 3035 3466 3537 6362 3663 3339 3963  4d054f57cb6c399c
	0x0210:  6365 3331 3033 6430 6163 3638 6530 6564  ce3103d0ac68e0ed
	0x0220:  3030 3030 3030 3030 3131 3061 6161 3263  00000000110aaa2c
	0x0230:  6632 3264 3634 3833 6265 3766 3638 3238  f22d6483be7f6828
	0x0240:  3761 3132 6164 3436 3464 3838 6534 3930  7a12ad464d88e490
	0x0250:  6166 6239 3636 3362 3162 6466 3337 6531  afb9663b1bdf37e1
	0x0260:  3562 6466 3631 3038 3038 222c 226a 6f62  5bdf610808","job
	0x0270:  5f69 6422 3a22 6237 222c 2274 6172 6765  _id":"b7","targe
	0x0280:  7422 3a22 6161 3433 3030 3030 222c 2261  t":"aa430000","a
	0x0290:  6c67 6f22 3a22 7278 2f30 222c 2268 6569  lgo":"rx/0","hei
	0x02a0:  6768 7422 3a32 3733 3833 3739 2c22 7365  ght":2738379,"se
	0x02b0:  6564 5f68 6173 6822 3a22 3261 3165 3965  ed_hash":"2a1e9e
	0x02c0:  3037 3038 3139 3865 6436 6335 6637 6631  0708198ed6c5f7f1
	0x02d0:  3830 3266 3038 3764 6336 6236 6465 6134  802f087dc6b6dea4
	0x02e0:  6234 3139 3032 6637 3535 6364 3636 3730  b41902f755cd6670
	0x02f0:  3337 3138 6235 3038 6164 227d 7d0a 7b22  3718b508ad"}}.{"
	0x0300:  6a73 6f6e 7270 6322 3a22 322e 3022 2c22  jsonrpc":"2.0","
	0x0310:  6d65 7468 6f64 223a 226a 6f62 222c 2270  method":"job","p
	0x0320:  6172 616d 7322 3a7b 2262 6c6f 6222 3a22  arams":{"blob":"
	0x0330:  3130 3130 6339 6536 6361 3961 3036 3865  1010c9e6ca9a068e
	0x0340:  3062 3665 3263 3035 3136 3666 3561 6130  0b6e2c05166f5aa0
	0x0350:  3662 3764 6431 6463 3734 6136 6538 3464  6b7dd1dc74a6e84d
	0x0360:  3035 3466 3537 6362 3663 3339 3963 6365  054f57cb6c399cce
	0x0370:  3331 3033 6430 6163 3638 6530 6564 3030  3103d0ac68e0ed00
	0x0380:  3030 3030 3030 3333 3232 6430 6264 6232  0000003322d0bdb2
	0x0390:  3530 3139 3461 3439 3339 3235 3839 3661  50194a493925896a
	0x03a0:  3739 6339 3036 3266 3439 3464 6139 3931  79c9062f494da991
	0x03b0:  6633 3565 3561 6636 6333 6663 3832 6361  f35e5af6c3fc82ca
	0x03c0:  6565 6331 6237 3038 222c 226a 6f62 5f69  eec1b708","job_i
	0x03d0:  6422 3a22 6238 222c 2274 6172 6765 7422  d":"b8","target"
	0x03e0:  3a22 6161 3433 3030 3030 222c 2261 6c67  :"aa430000","alg
	0x03f0:  6f22 3a22 7278 2f30 222c 2268 6569 6768  o":"rx/0","heigh
	0x0400:  7422 3a32 3733 3833 3739 2c22 7365 6564  t":2738379,"seed
	0x0410:  5f68 6173 6822 3a22 3261 3165 3965 3037  _hash":"2a1e9e07
	0x0420:  3038 3139 3865 6436 6335 6637 6631 3830  08198ed6c5f7f180
	0x0430:  3266 3038 3764 6336 6236 6465 6134 6234  2f087dc6b6dea4b4
	0x0440:  3139 3032 6637 3535 6364 3636 3730 3337  1902f755cd667037
	0x0450:  3138 6235 3038 6164 227d 7d0a 7b22 6a73  18b508ad"}}.{"js
	0x0460:  6f6e 7270 6322 3a22 322e 3022 2c22 6d65  onrpc":"2.0","me
	0x0470:  7468 6f64 223a 226a 6f62 222c 2270 6172  thod":"job","par
	0x0480:  616d 7322 3a7b 2262 6c6f 6222 3a22 3130  ams":{"blob":"10
	0x0490:  3130 6365 6536 6361 3961 3036 3865 3062  10cee6ca9a068e0b
	0x04a0:  3665 3263 3035 3136 3666 3561 6130 3662  6e2c05166f5aa06b
	0x04b0:  3764 6431 6463 3734 6136 6538 3464 3035  7dd1dc74a6e84d05
	0x04c0:  3466 3537 6362 3663 3339 3963 6365 3331  4f57cb6c399cce31
	0x04d0:  3033 6430 6163 3638 6530 6564 3030 3030  03d0ac68e0ed0000
	0x04e0:  3030 3030 3964 3861 3939 6435 6334 3264  00009d8a99d5c42d
	0x04f0:  3132 6561 3662 3536 3637 6239 3636 3137  12ea6b5667b96617
	0x0500:  3466 3961 6539 6165 3738 6232 3637 6365  4f9ae9ae78b267ce
	0x0510:  6239 6363 6636 3437 6635 3631 3330 3232  b9ccf647f5613022
	0x0520:  6336 6436 3038 222c 226a 6f62 5f69 6422  c6d608","job_id"
	0x0530:  3a22 6239 222c 2274 6172 6765 7422 3a22  :"b9","target":"
	0x0540:  6161 3433 3030 3030 222c 2261 6c67 6f22  aa430000","algo"
	0x0550:  3a22 7278 2f30 222c 2268 6569 6768 7422  :"rx/0","height"
	0x0560:  3a32 3733 3833 3739 2c22 7365 6564 5f68  :2738379,"seed_h
	0x0570:  6173 6822 3a22 3261 3165 3965 3037 3038  ash":"2a1e9e0708
	0x0580:  3139 3865 6436 6335 6637 6631 3830 3266  198ed6c5f7f1802f
	0x0590:  3038 3764 6336 6236 6465 6134 6234 3139  087dc6b6dea4b419
	0x05a0:  3032 6637 3535 6364 3636 3730 3337 3138  02f755cd66703718
	0x05b0:  6235 3038 6164 227d 7d0a 7b22 6a73 6f6e  b508ad"}}.{"json
	0x05c0:  7270 6322 3a22 322e 3022 2c22 6d65 7468  rpc":"2.0","meth
	0x05d0:  6f64 223a 226a 6f62 222c 2270 6172 616d  od":"job","param
	0x05e0:  7322 3a7b 2262 6c6f 6222 3a22 3130 3130  s":{"blob":"1010
	0x05f0:  6434 6536 6361 3961 3036 3865 3062 3665  d4e6ca9a068e0b6e
	0x0600:  3263 3035 3136 3666 3561 6130 3662 3764  2c05166f5aa06b7d
	0x0610:  6431 6463 3734 6136 6538 3464 3035 3466  d1dc74a6e84d054f
	0x0620:  3537 6362 3663 3339 3963 6365 3331 3033  57cb6c399cce3103
	0x0630:  6430 6163 3638 6530 6564 3030 3030 3030  d0ac68e0ed000000
	0x0640:  3030 6235 3663 6365 6438 3134 3034 6462  00b56cced81404db
	0x0650:  6234 6334 3933 6363 3830 6534 3833 6539  b4c493cc80e483e9
	0x0660:  6631 6137 6463 3466 6338 3432 3732 6538  f1a7dc4fc84272e8
	0x0670:  3232 6665 6263 3366 3234 6133 6130 3133  22febc3f24a3a013
	0x0680:  3963 3061 222c 226a 6f62 5f69 6422 3a22  9c0a","job_id":"
	0x0690:  6261 222c 2274 6172 6765 7422 3a22 6161  ba","target":"aa
	0x06a0:  3433 3030 3030 222c 2261 6c67 6f22 3a22  430000","algo":"
	0x06b0:  7278 2f30 222c 2268 6569 6768 7422 3a32  rx/0","height":2
	0x06c0:  3733 3833 3739 2c22 7365 6564 5f68 6173  738379,"seed_has
	0x06d0:  6822 3a22 3261 3165 3965 3037 3038 3139  h":"2a1e9e070819
	0x06e0:  3865 6436 6335 6637 6631 3830 3266 3038  8ed6c5f7f1802f08
	0x06f0:  3764 6336 6236 6465 6134 6234 3139 3032  7dc6b6dea4b41902
	0x0700:  6637 3535 6364 3636 3730 3337 3138 6235  f755cd66703718b5
	0x0710:  3038 6164 227d 7d0a 7b22 6964 223a 3135  08ad"}}.{"id":15
	0x0720:  3639 2c22 6a73 6f6e 7270 6322 3a22 322e  69,"jsonrpc":"2.
	0x0730:  3022 2c22 6572 726f 7222 3a7b 226d 6573  0","error":{"mes
	0x0740:  7361 6765 223a 2249 6e76 616c 6964 206a  sage":"Invalid.j
	0x0750:  6f62 2069 6422 7d7d 0a7b 226a 736f 6e72  ob.id"}}.{"jsonr
	0x0760:  7063 223a 2232 2e30 222c 226d 6574 686f  pc":"2.0","metho
	0x0770:  6422 3a22 6a6f 6222 2c22 7061 7261 6d73  d":"job","params
	0x0780:  223a 7b22 626c 6f62 223a 2231 3031 3065  ":{"blob":"1010e
	0x0790:  3265 3663 6139 6130 3638 6530 6236 6532  2e6ca9a068e0b6e2
	0x07a0:  6330 3531 3636 6635 6161 3036 6237 6464  c05166f5aa06b7dd
	0x07b0:  3164 6337 3461 3665 3834 6430 3534 6635  1dc74a6e84d054f5
	0x07c0:  3763 6236 6333 3939 6363 6533 3130 3364  7cb6c399cce3103d
	0x07d0:  3061 6336 3865 3065 6430 3030 3030 3030  0ac68e0ed0000000
	0x07e0:  3066 3562 3134 3464 3338 6664 6437 6563  0f5b144d38fdd7ec
	0x07f0:  3430 3535 6365 3464 6533 3835 6332 3638  4055ce4de385c268
	0x0800:  3932 3637 3164 3134 3466 3231 3437 6333  92671d144f2147c3
	0x0810:  3164 3730 6164 3963 3132 3564 3332 3731  1d70ad9c125d3271
	0x0820:  3630 6322 2c22 6a6f 625f 6964 223a 2262  60c","job_id":"b
	0x0830:  6222 2c22 7461 7267 6574 223a 2261 6134  b","target":"aa4
	0x0840:  3330 3030 3022 2c22 616c 676f 223a 2272  30000","algo":"r
	0x0850:  782f 3022 2c22 6865 6967 6874 223a 3237  x/0","height":27
	0x0860:  3338 3337 392c 2273 6565 645f 6861 7368  38379,"seed_hash
	0x0870:  223a 2232 6131 6539 6530 3730 3831 3938  ":"2a1e9e0708198
	0x0880:  6564 3663 3566 3766 3138 3032 6630 3837  ed6c5f7f1802f087
	0x0890:  6463 3662 3664 6561 3462 3431 3930 3266  dc6b6dea4b41902f
	0x08a0:  3735 3563 6436 3637 3033 3731 3862 3530  755cd66703718b50
	0x08b0:  3861 6422 7d7d 0a7b 226a 736f 6e72 7063  8ad"}}.{"jsonrpc
	0x08c0:  223a 2232 2e30 222c 226d 6574 686f 6422  ":"2.0","method"
	0x08d0:  3a22 6a6f 6222 2c22 7061 7261 6d73 223a  :"job","params":
	0x08e0:  7b22 626c 6f62 223a 2231 3031 3065 3965  {"blob":"1010e9e
	0x08f0:  3663 6139 6130 3638 6530 6236 6532 6330  6ca9a068e0b6e2c0
	0x0900:  3531 3636 6635 6161 3036 6237 6464 3164  5166f5aa06b7dd1d
	0x0910:  6337 3461 3665 3834 6430 3534 6635 3763  c74a6e84d054f57c
	0x0920:  6236 6333 3939 6363 6533 3130 3364 3061  b6c399cce3103d0a
	0x0930:  6336 3865 3065 6430 3030 3030 3030 3061  c68e0ed00000000a
	0x0940:  6139 6437 3062 3363 6132 6133 3237 6337  a9d70b3ca2a327c7
	0x0950:  6638 6438 3331 3363 3635 6133 3061 6662  f8d8313c65a30afb
	0x0960:  3138 3236 3039 3234 3166 6330 3138 3564  182609241fc0185d
	0x0970:  3231 6239 6330 3739 3132 3535 3132 6230  21b9c079125512b0
	0x0980:  6522 2c22 6a6f 625f 6964 223a 2262 6322  e","job_id":"bc"
	0x0990:  2c22 7461 7267 6574 223a 2261 6134 3330  ,"target":"aa430
	0x09a0:  3030 3022 2c22 616c 676f 223a 2272 782f  000","algo":"rx/
	0x09b0:  3022 2c22 6865 6967 6874 223a 3237 3338  0","height":2738
	0x09c0:  3337 392c 2273 6565 645f 6861 7368 223a  379,"seed_hash":
	0x09d0:  2232 6131 6539 6530 3730 3831 3938 6564  "2a1e9e0708198ed
	0x09e0:  3663 3566 3766 3138 3032 6630 3837 6463  6c5f7f1802f087dc
	0x09f0:  3662 3664 6561 3462 3431 3930 3266 3735  6b6dea4b41902f75
	0x0a00:  3563 6436 3637 3033 3731 3862 3530 3861  5cd66703718b508a
	0x0a10:  6422 7d7d 0a                             d"}}.
07:56:24.610382 IP 192.168.2.225.34392 > 23.124.76.211.3334: Flags [.], ack 69149, win 1640, options [nop,nop,TS val 1047776426 ecr 3211218511], length 0
	0x0000:  0c9d 92cf 8340 2a1b e951 e0b2 0800 4500  .....@*..Q....E.
	0x0010:  0034 2d2e 4000 3f06 e6bd c0a8 02e1 177c  .4-.@.?........|
	0x0020:  4cd3 8658 0d06 84ff 92b6 2d86 978a 8010  L..X......-.....
	0x0030:  0668 27ff 0000 0101 080a 3e73 ccaa bf67  .h'.......>s...g
	0x0040:  4e4f                                     NO
07:56:24.610582 IP 192.168.2.225.34392 > 23.124.76.211.3334: Flags [F.], seq 10274, ack 69149, win 1647, options [nop,nop,TS val 1047776427 ecr 3211218511], length 0
	0x0000:  0c9d 92cf 8340 2a1b e951 e0b2 0800 4500  .....@*..Q....E.
	0x0010:  0034 2d2f 4000 3f06 e6bc c0a8 02e1 177c  .4-/@.?........|
	0x0020:  4cd3 8658 0d06 84ff 92b6 2d86 978a 8011  L..X......-.....
	0x0030:  066f 27ff 0000 0101 080a 3e73 ccab bf67  .o'.......>s...g
	0x0040:  4e4f                                     NO
07:56:24.613817 IP 23.124.76.211.3334 > 172.17.0.2.34392: Flags [F.], seq 69149, ack 10276, win 501, options [nop,nop,TS val 3211218516 ecr 1047776427], length 0
	0x0000:  2a1b e951 e0b2 0c9d 92cf 8340 0800 4500  *..Q.......@..E.
	0x0010:  0034 8b64 4000 3e06 a0fd 177c 4cd3 ac11  .4.d@.>....|L...
	0x0020:  0002 0d06 8658 2d86 978a 84ff 92b7 8011  .....X-.........
	0x0030:  01f5 db63 0000 0101 080a bf67 4e54 3e73  ...c.......gNT>s
	0x0040:  ccab                                     ..
07:56:24.613958 IP 192.168.2.225.34392 > 23.124.76.211.3334: Flags [.], ack 69150, win 1647, options [nop,nop,TS val 1047776430 ecr 3211218516], length 0
	0x0000:  0c9d 92cf 8340 2a1b e951 e0b2 0800 4500  .....@*..Q....E.
	0x0010:  0034 2d30 4000 3f06 e6bb c0a8 02e1 177c  .4-0@.?........|
	0x0020:  4cd3 8658 0d06 84ff 92b7 2d86 978b 8010  L..X......-.....
	0x0030:  066f 27ff 0000 0101 080a 3e73 ccae bf67  .o'.......>s...g
	0x0040:  4e54                                     NT
07:56:30.339912 IP 192.168.2.225.39780 > 23.124.76.211.3334: Flags [S], seq 2562776377, win 64240, options [mss 1460,sackOK,TS val 1047782156 ecr 0,nop,wscale 7], length 0
	0x0000:  0c9d 92cf 8340 2a1b e951 e0b2 0800 4500  .....@*..Q....E.
	0x0010:  003c 1be8 4000 3f06 f7fb c0a8 02e1 177c  .<..@.?........|
	0x0020:  4cd3 9b64 0d06 98c0 dd39 0000 0000 a002  L..d.....9......
	0x0030:  faf0 2807 0000 0204 05b4 0402 080a 3e73  ..(...........>s
	0x0040:  e30c 0000 0000 0103 0307                 ..........
07:56:30.343747 IP 23.124.76.211.3334 > 172.17.0.2.39780: Flags [S.], seq 4182877898, ack 2562776378, win 65160, options [mss 1460,sackOK,TS val 3211224245 ecr 1047782156,nop,wscale 7], length 0
	0x0000:  2a1b e951 e0b2 0c9d 92cf 8340 0800 4500  *..Q.......@..E.
	0x0010:  003c 0000 4000 3e06 2c5a 177c 4cd3 ac11  .<..@.>.,Z.|L...
	0x0020:  0002 0d06 9b64 f951 a6ca 98c0 dd3a a012  .....d.Q.....:..
	0x0030:  fe88 34e5 0000 0204 05b4 0402 080a bf67  ..4............g
	0x0040:  64b5 3e73 e30c 0103 0307                 d.>s......
07:56:30.343840 IP 192.168.2.225.39780 > 23.124.76.211.3334: Flags [.], ack 4182877899, win 502, options [nop,nop,TS val 1047782160 ecr 3211224245], length 0
	0x0000:  0c9d 92cf 8340 2a1b e951 e0b2 0800 4500  .....@*..Q....E.
	0x0010:  0034 1be9 4000 3f06 f802 c0a8 02e1 177c  .4..@.?........|
	0x0020:  4cd3 9b64 0d06 98c0 dd3a f951 a6cb 8010  L..d.....:.Q....
	0x0030:  01f6 27ff 0000 0101 080a 3e73 e310 bf67  ..'.......>s...g
	0x0040:  64b5                                     d.
07:56:30.344008 IP 192.168.2.225.39780 > 23.124.76.211.3334: Flags [P.], seq 0:476, ack 1, win 502, options [nop,nop,TS val 1047782160 ecr 3211224245], length 476
	0x0000:  0c9d 92cf 8340 2a1b e951 e0b2 0800 4500  .....@*..Q....E.
	0x0010:  0210 1bea 4000 3f06 f625 c0a8 02e1 177c  ....@.?..%.....|
	0x0020:  4cd3 9b64 0d06 98c0 dd3a f951 a6cb 8018  L..d.....:.Q....
	0x0030:  01f6 29db 0000 0101 080a 3e73 e310 bf67  ..).......>s...g
	0x0040:  64b5 7b22 6964 223a 312c 226a 736f 6e72  d.{"id":1,"jsonr
	0x0050:  7063 223a 2232 2e30 222c 226d 6574 686f  pc":"2.0","metho
	0x0060:  6422 3a22 6c6f 6769 6e22 2c22 7061 7261  d":"login","para
	0x0070:  6d73 223a 7b22 6c6f 6769 6e22 3a22 7822  ms":{"login":"x"
	0x0080:  2c22 7061 7373 223a 2278 222c 2261 6765  ,"pass":"x","age
	0x0090:  6e74 223a 2258 4d52 6967 2f36 2e31 372e  nt":"XMRig/6.17.
	0x00a0:  3020 284c 696e 7578 2078 3836 5f36 3429  0.(Linux.x86_64)
	0x00b0:  206c 6962 7576 2f31 2e33 342e 3220 6763  .libuv/1.34.2.gc
	0x00c0:  632f 392e 342e 3022 2c22 616c 676f 223a  c/9.4.0","algo":
	0x00d0:  5b22 636e 2f31 222c 2263 6e2f 3222 2c22  ["cn/1","cn/2","
	0x00e0:  636e 2f72 222c 2263 6e2f 6661 7374 222c  cn/r","cn/fast",
	0x00f0:  2263 6e2f 6861 6c66 222c 2263 6e2f 7861  "cn/half","cn/xa
	0x0100:  6f22 2c22 636e 2f72 746f 222c 2263 6e2f  o","cn/rto","cn/
	0x0110:  7277 7a22 2c22 636e 2f7a 6c73 222c 2263  rwz","cn/zls","c
	0x0120:  6e2f 646f 7562 6c65 222c 2263 6e2f 6363  n/double","cn/cc
	0x0130:  7822 2c22 636e 2d6c 6974 652f 3122 2c22  x","cn-lite/1","
	0x0140:  636e 2d68 6561 7679 2f30 222c 2263 6e2d  cn-heavy/0","cn-
	0x0150:  6865 6176 792f 7475 6265 222c 2263 6e2d  heavy/tube","cn-
	0x0160:  6865 6176 792f 7868 7622 2c22 636e 2d70  heavy/xhv","cn-p
	0x0170:  6963 6f22 2c22 636e 2d70 6963 6f2f 746c  ico","cn-pico/tl
	0x0180:  6f22 2c22 636e 2f75 7078 3222 2c22 7278  o","cn/upx2","rx
	0x0190:  2f30 222c 2272 782f 776f 7722 2c22 7278  /0","rx/wow","rx
	0x01a0:  2f61 7271 222c 2272 782f 6772 6166 7422  /arq","rx/graft"
	0x01b0:  2c22 7278 2f73 6678 222c 2272 782f 6b65  ,"rx/sfx","rx/ke
	0x01c0:  7661 222c 2261 7267 6f6e 322f 6368 756b  va","argon2/chuk
	0x01d0:  7761 222c 2261 7267 6f6e 322f 6368 756b  wa","argon2/chuk
	0x01e0:  7761 7632 222c 2261 7267 6f6e 322f 6e69  wav2","argon2/ni
	0x01f0:  6e6a 6122 2c22 6173 7472 6f62 7774 222c  nja","astrobwt",
	0x0200:  2261 7374 726f 6277 742f 7632 222c 2267  "astrobwt/v2","g
	0x0210:  686f 7374 7269 6465 7222 5d7d 7d0a       hostrider"]}}.
```

**Comment by SChernykh** [comment]
> rejected (1493/28) diff 247948 "Invalid job id" (17400 ms)

XMRig shows 17400 ms, so you had temporary internet disruption somewhere between you and your p2pool node.

**Comment by bladedoyle** [comment]
oh.  That's embarrassing.  It seems like rebooting a router resolved the issue.
